{"$id":"https://example.com/card-dashboard/schemas/portfolio.schema.json","$schema":"http://json-schema.org/draft-07/schema#","description":"Portfolio data file for Card Dashboard. Keep it fictional in the public repo; your real file is my-portfolio.json (gitignored).","properties":{"cards":{"items":{"properties":{"color":{"description":"CSS color for the card tile accent","type":"string"},"earns":{"description":"Pairs of [spend bucket, earn rate] as displayed","items":{"items":{"type":"string"},"maxItems":2,"minItems":2,"type":"array"},"type":"array"},"fee":{"description":"Display string, e.g. '$95/yr' or '$0'","type":"string"},"filters":{"description":"Jobs the card performs. travel/cash/premium/rotating sort first with friendly labels; any other value gets its own auto-generated filter button.","items":{"type":"string"},"type":"array"},"issuer":{"type":"string"},"name":{"description":"Display name, e.g. 'Summit Reserve'","type":"string"},"role":{"description":"One-line job of the card in the wallet","type":"string"},"tags":{"items":{"type":"string"},"type":"array"}},"required":["name","issuer","fee","role","color","earns","tags","filters"],"type":"object"},"minItems":1,"type":"array"},"categories":{"description":"Spend-guide categories. Must include an 'other' fallback id.","items":{"properties":{"alert":{"items":{"type":"string"},"maxItems":2,"minItems":2,"type":"array"},"alts":{"description":"Runner-ups as [card name, rate, note]","items":{"items":{"type":"string"},"maxItems":3,"minItems":3,"type":"array"},"type":"array"},"bg":{"description":"CSS color for the recommendation tile","type":"string"},"card":{"description":"Name of the recommended card (should match a card name)","type":"string"},"headline":{"type":"string"},"id":{"description":"Stable slug, e.g. 'dining'. Used by merchantCategories.","type":"string"},"label":{"type":"string"},"rate":{"type":"string"},"rateNote":{"type":"string"},"why":{"type":"string"}},"required":["id","label","card","rate","rateNote","headline","why","bg","alert","alts"],"type":"object"},"minItems":1,"type":"array"},"merchantCategories":{"description":"Substring rules mapping merchant names to category ids. First match wins.","items":{"properties":{"category":{"type":"string"},"terms":{"items":{"type":"string"},"type":"array"}},"required":["terms","category"],"type":"object"},"type":"array"},"meta":{"properties":{"benefitsHeading":{"type":"string"},"cardsHeading":{"description":"May contain {n}, replaced with the card count","type":"string"},"eyebrow":{"type":"string"},"feesNote":{"type":"string"},"heroCopy":{"type":"string"},"heroHeading":{"type":"string"},"lastUpdated":{"type":"string"},"monthlyFinePrint":{"type":"string"},"monthlyTotal":{"type":"string"},"monthlyTotalLabel":{"type":"string"},"sourcesNote":{"type":"string"},"totalFees":{"type":"string"}},"type":"object"},"monthlyCredits":{"items":{"properties":{"amount":{"type":"string"},"card":{"type":"string"},"detail":{"type":"string"},"label":{"type":"string"}},"required":["card","label","detail","amount"],"type":"object"},"type":"array"},"offerPrograms":{"items":{"properties":{"cards":{"items":{"type":"string"},"type":"array"},"color":{"type":"string"},"program":{"type":"string"}},"required":["program","cards"],"type":"object"},"type":"array"},"periodCredits":{"items":{"properties":{"group":{"type":"string"},"items":{"items":{"properties":{"detail":{"type":"string"},"title":{"type":"string"},"when":{"type":"string"}},"required":["when","title","detail"],"type":"object"},"type":"array"}},"required":["group","items"],"type":"object"},"type":"array"},"sources":{"items":{"type":"string"},"type":"array"},"walletRules":{"items":{"properties":{"label":{"type":"string"},"rate":{"type":"string"}},"required":["rate","label"],"type":"object"},"type":"array"}},"required":["cards","categories"],"title":"Card Dashboard portfolio","type":"object"}